[
  {
    "conceptId": 1092148,
    "conceptName": "Glucose [Mass/volume] in Mixed venous blood",
    "sourceUnitConceptId": 8636,
    "sourceUnitCode": "g/L",
    "sourceUnitName": "gram per liter",
    "conversionFactor": 5.55062,
    "targetUnitConceptId": 8753,
    "targetUnitCode": "mmol/L",
    "targetUnitName": "millimole per liter"
  },
  {
    "conceptId": 1175183,
    "conceptName": "Bilirubin.total [Moles/volume] in Arterial blood",
    "sourceUnitConceptId": 8749,
    "sourceUnitCode": "umol/L",
    "sourceUnitName": "micromole per liter",
    "conversionFactor": 0.058466,
    "targetUnitConceptId": 8840,
    "targetUnitCode": "mg/dL",
    "targetUnitName": "milligram per deciliter"
  },
  {
    "conceptId": 3009542,
    "conceptName": "Hematocrit [Volume Fraction] of Blood",
    "sourceUnitConceptId": 44777604,
    "sourceUnitCode": "L/L",
    "sourceUnitName": "liter per liter",
    "conversionFactor": 100,
    "targetUnitConceptId": 8554,
    "targetUnitCode": "%",
    "targetUnitName": "percent"
  },
  {
    "conceptId": 3004410,
    "conceptName": "Hemoglobin A1c/Hemoglobin.total in Blood",
    "sourceUnitConceptId": 8554,
    "sourceUnitCode": "%",
    "sourceUnitName": "percent",
    "conversionFactor": 10.929,
    "offset": -23.5,
    "targetUnitConceptId": 9579,
    "targetUnitCode": "mmol/mol",
    "targetUnitName": "millimole per mole"
  },
  {
    "conceptId": 3004410,
    "conceptName": "Hemoglobin A1c/Hemoglobin.total in Blood",
    "sourceUnitConceptId": 9579,
    "sourceUnitCode": "mmol/mol",
    "sourceUnitName": "millimole per mole",
    "conversionFactor": 0.09148,
    "offset": 2.152,
    "targetUnitConceptId": 8554,
    "targetUnitCode": "%",
    "targetUnitName": "percent"
  },
  {
    "conceptId": 3003309,
    "conceptName": "Hemoglobin A1c/Hemoglobin.total in Blood by Electrophoresis",
    "sourceUnitConceptId": 8554,
    "sourceUnitCode": "%",
    "sourceUnitName": "percent",
    "conversionFactor": 10.929,
    "offset": -23.5,
    "targetUnitConceptId": 9579,
    "targetUnitCode": "mmol/mol",
    "targetUnitName": "millimole per mole"
  },
  {
    "conceptId": 3003309,
    "conceptName": "Hemoglobin A1c/Hemoglobin.total in Blood by Electrophoresis",
    "sourceUnitConceptId": 9579,
    "sourceUnitCode": "mmol/mol",
    "sourceUnitName": "millimole per mole",
    "conversionFactor": 0.09148,
    "offset": 2.152,
    "targetUnitConceptId": 8554,
    "targetUnitCode": "%",
    "targetUnitName": "percent"
  },
  {
    "conceptId": 3005673,
    "conceptName": "Hemoglobin A1c/Hemoglobin.total in Blood by HPLC",
    "sourceUnitConceptId": 8554,
    "sourceUnitCode": "%",
    "sourceUnitName": "percent",
    "conversionFactor": 10.929,
    "offset": -23.5,
    "targetUnitConceptId": 9579,
    "targetUnitCode": "mmol/mol",
    "targetUnitName": "millimole per mole"
  },
  {
    "conceptId": 3005673,
    "conceptName": "Hemoglobin A1c/Hemoglobin.total in Blood by HPLC",
    "sourceUnitConceptId": 9579,
    "sourceUnitCode": "mmol/mol",
    "sourceUnitName": "millimole per mole",
    "conversionFactor": 0.09148,
    "offset": 2.152,
    "targetUnitConceptId": 8554,
    "targetUnitCode": "%",
    "targetUnitName": "percent"
  },
  {
    "conceptId": 3007263,
    "conceptName": "Hemoglobin A1c/Hemoglobin.total in Blood by calculation",
    "sourceUnitConceptId": 8554,
    "sourceUnitCode": "%",
    "sourceUnitName": "percent",
    "conversionFactor": 10.929,
    "offset": -23.5,
    "targetUnitConceptId": 9579,
    "targetUnitCode": "mmol/mol",
    "targetUnitName": "millimole per mole"
  },
  {
    "conceptId": 3007263,
    "conceptName": "Hemoglobin A1c/Hemoglobin.total in Blood by calculation",
    "sourceUnitConceptId": 9579,
    "sourceUnitCode": "mmol/mol",
    "sourceUnitName": "millimole per mole",
    "conversionFactor": 0.09148,
    "offset": 2.152,
    "targetUnitConceptId": 8554,
    "targetUnitCode": "%",
    "targetUnitName": "percent"
  },
  {
    "conceptId": 1259509,
    "conceptName": "Body temperature - Groin",
    "sourceUnitConceptId": 9289,
    "sourceUnitCode": "[degF]",
    "sourceUnitName": "degree Fahrenheit",
    "conversionFactor": 0.555556,
    "offset": -17.777778,
    "targetUnitConceptId": 586323,
    "targetUnitCode": "Cel",
    "targetUnitName": "degree Celsius"
  },
  {
    "conceptId": 1259509,
    "conceptName": "Body temperature - Groin",
    "sourceUnitConceptId": 586323,
    "sourceUnitCode": "Cel",
    "sourceUnitName": "degree Celsius",
    "conversionFactor": 1.8,
    "offset": 32,
    "targetUnitConceptId": 9289,
    "targetUnitCode": "[degF]",
    "targetUnitName": "degree Fahrenheit"
  },
  {
    "conceptId": 3006322,
    "conceptName": "Oral temperature",
    "sourceUnitConceptId": 9289,
    "sourceUnitCode": "[degF]",
    "sourceUnitName": "degree Fahrenheit",
    "conversionFactor": 0.555556,
    "offset": -17.777778,
    "targetUnitConceptId": 586323,
    "targetUnitCode": "Cel",
    "targetUnitName": "degree Celsius"
  },
  {
    "conceptId": 3006322,
    "conceptName": "Oral temperature",
    "sourceUnitConceptId": 586323,
    "sourceUnitCode": "Cel",
    "sourceUnitName": "degree Celsius",
    "conversionFactor": 1.8,
    "offset": 32,
    "targetUnitConceptId": 9289,
    "targetUnitCode": "[degF]",
    "targetUnitName": "degree Fahrenheit"
  },
  {
    "conceptId": 3007416,
    "conceptName": "Body temperature - Intravascular",
    "sourceUnitConceptId": 9289,
    "sourceUnitCode": "[degF]",
    "sourceUnitName": "degree Fahrenheit",
    "conversionFactor": 0.555556,
    "offset": -17.777778,
    "targetUnitConceptId": 586323,
    "targetUnitCode": "Cel",
    "targetUnitName": "degree Celsius"
  },
  {
    "conceptId": 3007416,
    "conceptName": "Body temperature - Intravascular",
    "sourceUnitConceptId": 586323,
    "sourceUnitCode": "Cel",
    "sourceUnitName": "degree Celsius",
    "conversionFactor": 1.8,
    "offset": 32,
    "targetUnitConceptId": 9289,
    "targetUnitCode": "[degF]",
    "targetUnitName": "degree Fahrenheit"
  },
  {
    "conceptId": 3020891,
    "conceptName": "Body temperature",
    "sourceUnitConceptId": 9289,
    "sourceUnitCode": "[degF]",
    "sourceUnitName": "degree Fahrenheit",
    "conversionFactor": 0.555556,
    "offset": -17.777778,
    "targetUnitConceptId": 586323,
    "targetUnitCode": "Cel",
    "targetUnitName": "degree Celsius"
  },
  {
    "conceptId": 3020891,
    "conceptName": "Body temperature",
    "sourceUnitConceptId": 586323,
    "sourceUnitCode": "Cel",
    "sourceUnitName": "degree Celsius",
    "conversionFactor": 1.8,
    "offset": 32,
    "targetUnitConceptId": 9289,
    "targetUnitCode": "[degF]",
    "targetUnitName": "degree Fahrenheit"
  },
  {
    "conceptId": 3022060,
    "conceptName": "Rectal temperature",
    "sourceUnitConceptId": 9289,
    "sourceUnitCode": "[degF]",
    "sourceUnitName": "degree Fahrenheit",
    "conversionFactor": 0.555556,
    "offset": -17.777778,
    "targetUnitConceptId": 586323,
    "targetUnitCode": "Cel",
    "targetUnitName": "degree Celsius"
  },
  {
    "conceptId": 3022060,
    "conceptName": "Rectal temperature",
    "sourceUnitConceptId": 586323,
    "sourceUnitCode": "Cel",
    "sourceUnitName": "degree Celsius",
    "conversionFactor": 1.8,
    "offset": 32,
    "targetUnitConceptId": 9289,
    "targetUnitCode": "[degF]",
    "targetUnitName": "degree Fahrenheit"
  },
  {
    "conceptId": 3025085,
    "conceptName": "Axillary temperature",
    "sourceUnitConceptId": 9289,
    "sourceUnitCode": "[degF]",
    "sourceUnitName": "degree Fahrenheit",
    "conversionFactor": 0.555556,
    "offset": -17.777778,
    "targetUnitConceptId": 586323,
    "targetUnitCode": "Cel",
    "targetUnitName": "degree Celsius"
  },
  {
    "conceptId": 3025085,
    "conceptName": "Axillary temperature",
    "sourceUnitConceptId": 586323,
    "sourceUnitCode": "Cel",
    "sourceUnitName": "degree Celsius",
    "conversionFactor": 1.8,
    "offset": 32,
    "targetUnitConceptId": 9289,
    "targetUnitCode": "[degF]",
    "targetUnitName": "degree Fahrenheit"
  },
  {
    "conceptId": 3025704,
    "conceptName": "Body temperature - Urinary bladder",
    "sourceUnitConceptId": 9289,
    "sourceUnitCode": "[degF]",
    "sourceUnitName": "degree Fahrenheit",
    "conversionFactor": 0.555556,
    "offset": -17.777778,
    "targetUnitConceptId": 586323,
    "targetUnitCode": "Cel",
    "targetUnitName": "degree Celsius"
  },
  {
    "conceptId": 3025704,
    "conceptName": "Body temperature - Urinary bladder",
    "sourceUnitConceptId": 586323,
    "sourceUnitCode": "Cel",
    "sourceUnitName": "degree Celsius",
    "conversionFactor": 1.8,
    "offset": 32,
    "targetUnitConceptId": 9289,
    "targetUnitCode": "[degF]",
    "targetUnitName": "degree Fahrenheit"
  },
  {
    "conceptId": 3025926,
    "conceptName": "Body temperature - Core",
    "sourceUnitConceptId": 9289,
    "sourceUnitCode": "[degF]",
    "sourceUnitName": "degree Fahrenheit",
    "conversionFactor": 0.555556,
    "offset": -17.777778,
    "targetUnitConceptId": 586323,
    "targetUnitCode": "Cel",
    "targetUnitName": "degree Celsius"
  },
  {
    "conceptId": 3025926,
    "conceptName": "Body temperature - Core",
    "sourceUnitConceptId": 586323,
    "sourceUnitCode": "Cel",
    "sourceUnitName": "degree Celsius",
    "conversionFactor": 1.8,
    "offset": 32,
    "targetUnitConceptId": 9289,
    "targetUnitCode": "[degF]",
    "targetUnitName": "degree Fahrenheit"
  },
  {
    "conceptId": 3032679,
    "conceptName": "Body temperature --after transfusion reaction",
    "sourceUnitConceptId": 9289,
    "sourceUnitCode": "[degF]",
    "sourceUnitName": "degree Fahrenheit",
    "conversionFactor": 0.555556,
    "offset": -17.777778,
    "targetUnitConceptId": 586323,
    "targetUnitCode": "Cel",
    "targetUnitName": "degree Celsius"
  },
  {
    "conceptId": 3032679,
    "conceptName": "Body temperature --after transfusion reaction",
    "sourceUnitConceptId": 586323,